{
  "$schema": "https://json-schema.org/draft/2020-12/schema",
  "$id": "https://opscotch.co/test.schema.json",
  "title": "opscotch Test configuration",
  "description": "The test configuration for the opscotch test runner",
  "type": "object",
  "unevaluatedProperties": false,
  "required": [
    "fromDirectory",
    "testThisStep",
    "useThisTestConfigFile"
  ],
  "properties": {
    "ignore": {
      "description": "If true the test will not be run",
      "type": "boolean",
      "default": false
    },
    "fromDirectory": {
      "description": "The relative path from the test directory to the test resources",
      "type": "string"
    },
    "testThisStep": {
      "description": "The name of the workflow step to trigger for the test",
      "type": "string"
    },
    "useThisTestConfigFile": {
      "description": "The workflow configuration file to load for the test",
      "type": "string"
    },
    "useThisTestBootstrapFile": {
      "description": "The bootstrap configuration to include for the test",
      "type": "string"
    },
    "manifest": {
      "$ref": "#/$defs/manifest"
    },
    "mockEndpointResponses": {
      "description": "The mocked HTTP responses the test runner should serve",
      "type": "array",
      "items": {
        "$ref": "#/$defs/mockHttpResponse"
      }
    },
    "theseMetricsShouldHaveBeenSent": {
      "description": "The metrics that are expected to be generated by the workflow configuration",
      "type": "array",
      "items": {
        "$ref": "#/$defs/sendMetricVerification"
      }
    },
    "theseLogsShouldHaveBeenSent": {
      "description": "The logs that are expected to be generated by the workflow configuration",
      "type": "array",
      "items": {
        "type": "string"
      }
    },
    "logsShouldNotContain": {
      "description": "The log fragments that must not be generated by the workflow configuration",
      "type": "array",
      "items": {
        "type": "string"
      }
    },
    "makeTheseCalls": {
      "description": "HTTP calls to make against the agent and assert the response",
      "type": "array",
      "items": {
        "$ref": "#/$defs/httpCall"
      }
    },
    "timestampOverride": {
      "description": "A millisecond timestamp used to override the system clock during the test",
      "type": "integer"
    },
    "secondsToWaitForCompletion": {
      "description": "How long to wait for logs and metric assertions before the test stops",
      "type": "integer",
      "default": 10
    },
    "data": {
      "description": "Additional JSON data to merge into the test configuration",
      "type": "object"
    }
  },
  "$defs": {
    "manifest": {
      "description": "Workflow manifest manipulations to apply before the test runs",
      "type": "object",
      "unevaluatedProperties": false,
      "properties": {
        "includes": {
          "type": "array",
          "items": {
            "$ref": "#/$defs/manifestInclude"
          }
        },
        "customizations": {
          "type": "array",
          "items": {
            "$ref": "#/$defs/manifestCustomization"
          }
        }
      }
    },
    "manifestInclude": {
      "description": "A workflow source to include in the manifest",
      "type": "object",
      "unevaluatedProperties": false,
      "properties": {
        "sourceWorkflow": {
          "description": "Relative path to a workflow JSON file under the test's fromDirectory",
          "type": "string"
        },
        "customizations": {
          "type": "array",
          "items": {
            "$ref": "#/$defs/manifestCustomization"
          }
        }
      }
    },
    "manifestCustomization": {
      "description": "A single manifest customization operation",
      "type": "object",
      "required": [
        "op",
        "sourcePath"
      ],
      "unevaluatedProperties": false,
      "properties": {
        "op": {
          "description": "Customization operation",
          "type": "string",
          "enum": [
            "value",
            "add",
            "delete"
          ]
        },
        "sourcePath": {
          "description": "JSONPath-like source path to modify",
          "type": "string"
        },
        "sourceValue": {
          "description": "Value to assign or append when the operation requires one",
          "type": [
            "boolean",
            "integer",
            "number",
            "string",
            "object",
            "array",
            "null"
          ]
        }
      }
    },
    "mockHttpResponse": {
      "description": "The mocked HTTP response the test runner should return",
      "type": "object",
      "required": [
        "whenThisIsCalled"
      ],
      "unevaluatedProperties": false,
      "properties": {
        "whenThisIsCalled": {
          "description": "The complete URL that the mock server will listen for",
          "type": "string"
        },
        "expectedPayload": {
          "description": "If set, asserts the exact payload that was received",
          "type": "string"
        },
        "expectedHeaders": {
          "description": "Expected request headers",
          "type": "object",
          "additionalProperties": {
            "type": "array",
            "items": {
              "type": "string"
            }
          }
        },
        "returnThisFile": {
          "description": "The file path of the response to return",
          "type": "string"
        },
        "returnThisBody": {
          "description": "The response body to return directly",
          "type": "string"
        },
        "returnThisStatusCode": {
          "description": "The status code to return",
          "type": "integer"
        },
        "mockedHeaders": {
          "description": "Response headers to return",
          "type": "object",
          "additionalProperties": {
            "type": "array",
            "items": {
              "type": "string"
            }
          }
        },
        "withMethod": {
          "description": "The HTTP method expected for the request",
          "type": "string"
        },
        "thisManyTimes": {
          "description": "The number of times this endpoint should be invoked",
          "type": "integer"
        },
        "delay": {
          "description": "The number of milliseconds to delay the response",
          "type": "integer",
          "default": 0
        }
      }
    },
    "sendMetricVerification": {
      "description": "An expected metric emitted by the workflow configuration",
      "type": "object",
      "required": [
        "key",
        "value"
      ],
      "unevaluatedProperties": false,
      "properties": {
        "timestamp": {
          "description": "Assert the exact timestamp on the metric, otherwise the timestamp is ignored",
          "type": "integer"
        },
        "key": {
          "description": "Assert the exact metric key",
          "type": "string"
        },
        "value": {
          "description": "Assert the exact metric value",
          "type": "number"
        },
        "dimensionMap": {
          "description": "Assert that the received and expected dimensions are exact",
          "type": "object",
          "additionalProperties": {
            "type": "string"
          }
        }
      }
    },
    "httpCall": {
      "description": "An HTTP call to make against the agent and assert the response",
      "type": "object",
      "required": [
        "url"
      ],
      "unevaluatedProperties": false,
      "properties": {
        "url": {
          "description": "The URL to call",
          "type": "string"
        },
        "expectedResponse": {
          "description": "The expected response body",
          "type": "string"
        },
        "expectedResponseCode": {
          "description": "The expected HTTP response code",
          "type": "integer",
          "default": 200
        },
        "expectedSize": {
          "description": "The expected size of the response",
          "type": "integer"
        },
        "method": {
          "description": "The HTTP method to use",
          "type": "string",
          "default": "get"
        },
        "headers": {
          "description": "The HTTP headers to use as key/value pairs",
          "type": "array",
          "items": {
            "type": "array",
            "minItems": 2,
            "maxItems": 2,
            "items": {
              "type": "string"
            }
          }
        },
        "body": {
          "description": "The HTTP body to send",
          "type": "string"
        },
        "timeoutSeconds": {
          "description": "The allowed timeout of the HTTP call in seconds",
          "type": "integer",
          "default": 10
        }
      }
    }
  }
}
