{
  "fromDirectory": "/elastic/indexes/",
  "testThisStep": "get-index-docs-out-of-band",
  "useThisTestConfigFile": "ElasticJavascriptIndexOutOfBand.config.json",
  "useThisTestBootstrapFile" : "Elastic.bootstrap.json",
  "mockEndpointResponses": [
    {
      "whenThisIsCalled": "http://mockserver/_cat/indices?format=json&bytes=kb",
      "returnThisFile": "/elastic/indexes/ElasticJavascriptIndexOutOfBand.response.json"
    }
  ],
  "theseMetricsShouldHaveBeenSent": [
    {
      
      "key": "out-of-band-index_name_1",
      "value": 0,
      "dimensionMap" : { "IndexName": "" }
    },
    {
      "key": "out-of-band-index_name_2",
      "value": 0,
      "dimensionMap" : { "IndexName": "" }
     },    
     {
      "key": "out-of-band-index_name_3",
      "value": 0,
      "dimensionMap" : { "IndexName": "" }
     }
  ]
}
