{
  "fromDirectory": "../../../../../apps/opscotch-key-store",
  "useThisTestBootstrapFile": "../../community/opscotch-community/tests/apps/opscotch-key-store/key-store-cross-deployment.bootstrap.json",
  "useThisTestConfigFile": "../../community/opscotch-community/tests/apps/opscotch-key-store/test.workflow.cross-deployment.json",
  "testThisStep": "testTrigger",
  "data": {
    "storageDeploymentAccessId": "storage-call",
    "storageStepId": "accept-storage"
  },
  "manifest": {
    "customizations": [
      {
        "op": "delete",
        "sourcePath": "$.workflows[0].steps[0].trigger.deploymentAccess"
      },
      {
        "op": "add",
        "sourcePath": "$.workflows[0].steps[7]",
        "sourceValue": {
          "stepId": "testTrigger",
          "resultsProcessor": {
            "script": "function call(request) { var response = context.sendToStep('accept-key-store', JSON.stringify(request)); if (response.isErrored()) throw new Error(response.getAllErrors()[0]); return JSON.parse(response.getBody()); } var generated = call({ getOrGenerate: { keyId: 'service/generated', purpose: 'sign' } }); if (generated.keyId !== 'service/generated' || generated.purpose !== 'sign' || generated.created !== true || generated.keyPair.secretKeyHex === undefined) throw new Error('expected generated immutable key pair'); var repeated = call({ getOrGenerate: { keyId: 'service/generated', purpose: 'sign' } }); if (repeated.created !== false || repeated.keyPair.secretKeyHex !== generated.keyPair.secretKeyHex) throw new Error('expected existing generated key pair'); var invalid = context.sendToStep('accept-key-store', JSON.stringify({ put: { keyId: 'service/generated', value: 'AQ==' } })); if (!invalid.isErrored()) throw new Error('expected immutable put rejection'); context.sendMetric('key-store-cross-deployment-pass', 1.0);"
          }
        }
      }
    ]
  },
  "theseMetricsShouldHaveBeenSent": [
    { "key": "key-store-cross-deployment-pass", "value": 1.0 }
  ]
}
