{
  "fromDirectory": "/elastic/appsearch/",
  "testThisStep": "get-indexing-count",
  "useThisTestConfigFile": "ElasticJavascriptAppSearchDocumentIndexing.config.json",
  "useThisTestBootstrapFile" : "ElasticAppSearch.bootstrap.json",
  "mockEndpointResponses": [
    {
      "whenThisIsCalled": "http://mockserver/.ent-search-engine-documents-nzqa-prod-search/_count",
      "withMethod" : "GET",
      "returnThisFile": "/elastic/appsearch/ElasticJavascriptAppSearchDocumentIndexing.response.json",
      "expectedPayload" : "{\"query\":{\"bool\":{\"filter\":[{\"range\":{\"indexed.date\":{\"gte\":\"now-7d\"}}}]}}}"
    }
  ],
  "theseMetricsShouldHaveBeenSent": [
    {
      "key": "elastic-appsearch-documents-indexed-7-days",
      "value": 50576
    }
  ]
}
